{
  "delivery_boundary": "mapping_only_no_third_party_api_calls",
  "event_count": 1,
  "filters": {
    "event_id": "2024-01-04-openai-gpt3-completions-retirement",
    "kind": null,
    "limit": 20,
    "provider": null,
    "risk": "medium",
    "since": "2024-01-01"
  },
  "generated_at": "2026-06-02T00:00:00Z",
  "records": [
    {
      "event": {
        "confidence": "confirmed",
        "detail_refs": {
          "model_refs": [
            "model:text-ada-001",
            "model:text-babbage-001",
            "model:text-curie-001",
            "model:text-davinci-001",
            "model:text-davinci-002",
            "model:text-davinci-003",
            "model:ada",
            "model:babbage",
            "model:curie",
            "model:davinci",
            "model:code-davinci-002",
            "model:text-davinci-edit-001",
            "model:code-davinci-edit-001",
            "model:text-similarity-ada-001",
            "model:text-search-ada-doc-001",
            "model:text-search-ada-query-001",
            "model:code-search-ada-code-001",
            "model:code-search-ada-text-001",
            "model:text-similarity-babbage-001",
            "model:text-search-babbage-doc-001",
            "model:text-search-babbage-query-001",
            "model:code-search-babbage-code-001",
            "model:code-search-babbage-text-001",
            "model:text-similarity-curie-001",
            "model:text-search-curie-doc-001"
          ],
          "replacement_refs": [
            "model:gpt-3.5-turbo-instruct",
            "model:babbage-002",
            "model:davinci-002",
            "model:text-embedding-3-small",
            "model:gpt-4o"
          ]
        },
        "effective_at": "2024-01-04T00:00:00Z",
        "event_date": "2024-01-04",
        "event_kind": "model_retirement",
        "evidence_refs": [
          {
            "authority": "official_docs",
            "content_sha256": "7d7b0591c6e35e02c7b08e92436f79d78c62f644cef43e01bf4c888ca7e5686b",
            "retrieved_at": "2026-06-01T10:36:49Z",
            "source_key": "openai.deprecations",
            "url": "https://platform.openai.com/docs/deprecations"
          }
        ],
        "id": "2024-01-04-openai-gpt3-completions-retirement",
        "impacts": [
          {
            "confidence": "confirmed",
            "direction": "removed",
            "impact_kind": "availability",
            "recommended_action": "Search production and agent configuration for retired model IDs and migrate affected calls before relying on this API surface.",
            "scope_ref": "surface:openai/api",
            "scope_type": "provider_surface",
            "severity": "medium"
          },
          {
            "confidence": "confirmed",
            "direction": "changed",
            "impact_kind": "migration",
            "recommended_action": "Update SDK defaults, fixture model IDs, and documentation examples that still reference legacy completions models.",
            "scope_ref": "surface:openai/api",
            "scope_type": "provider_surface",
            "severity": "medium"
          }
        ],
        "lifecycle_status": "reviewed",
        "migration_deadline": "2024-01-04T00:00:00Z",
        "observed_at": "2026-06-01T10:36:49Z",
        "provider_refs": [
          "provider:openai"
        ],
        "severity": "medium",
        "source_authority": "official_docs",
        "summary": "OpenAI retired older GPT-3 completions-era model IDs and first-generation embedding models, requiring applications that still referenced those IDs to migrate to replacement models.",
        "title": "OpenAI Retires Older GPT-3 Completions Models"
      },
      "lookup": {
        "impact_scope_refs": [
          "surface:openai/api",
          "surface:openai/api"
        ],
        "model_refs": [
          "model:text-ada-001",
          "model:text-babbage-001",
          "model:text-curie-001",
          "model:text-davinci-001",
          "model:text-davinci-002",
          "model:text-davinci-003",
          "model:ada",
          "model:babbage",
          "model:curie",
          "model:davinci",
          "model:code-davinci-002",
          "model:text-davinci-edit-001",
          "model:code-davinci-edit-001",
          "model:text-similarity-ada-001",
          "model:text-search-ada-doc-001",
          "model:text-search-ada-query-001",
          "model:code-search-ada-code-001",
          "model:code-search-ada-text-001",
          "model:text-similarity-babbage-001",
          "model:text-search-babbage-doc-001",
          "model:text-search-babbage-query-001",
          "model:code-search-babbage-code-001",
          "model:code-search-babbage-text-001",
          "model:text-similarity-curie-001",
          "model:text-search-curie-doc-001",
          "model:text-search-curie-query-001",
          "model:text-similarity-davinci-001",
          "model:text-search-davinci-doc-001",
          "model:text-search-davinci-query-001"
        ],
        "provider_refs": [
          "provider:openai"
        ],
        "replacement_refs": [
          "model:gpt-3.5-turbo-instruct",
          "model:babbage-002",
          "model:davinci-002",
          "model:text-embedding-3-small",
          "model:gpt-4o"
        ],
        "target_model_ids": [
          "ada",
          "babbage",
          "babbage-002",
          "code-davinci-002",
          "code-davinci-edit-001",
          "code-search-ada-code-001",
          "code-search-ada-text-001",
          "code-search-babbage-code-001",
          "code-search-babbage-text-001",
          "curie",
          "davinci",
          "davinci-002",
          "gpt-3.5-turbo-instruct",
          "gpt-4o",
          "openai/ada",
          "openai/babbage",
          "openai/babbage-002",
          "openai/code-davinci-002",
          "openai/code-davinci-edit-001",
          "openai/code-search-ada-code-001",
          "openai/code-search-ada-text-001",
          "openai/code-search-babbage-code-001",
          "openai/code-search-babbage-text-001",
          "openai/curie",
          "openai/davinci",
          "openai/davinci-002",
          "openai/gpt-3.5-turbo-instruct",
          "openai/gpt-4o",
          "openai/text-ada-001",
          "openai/text-babbage-001",
          "openai/text-curie-001",
          "openai/text-davinci-001",
          "openai/text-davinci-002",
          "openai/text-davinci-003",
          "openai/text-davinci-edit-001",
          "openai/text-embedding-3-small",
          "openai/text-search-ada-doc-001",
          "openai/text-search-ada-query-001",
          "openai/text-search-babbage-doc-001",
          "openai/text-search-babbage-query-001",
          "openai/text-search-curie-doc-001",
          "openai/text-search-curie-query-001",
          "openai/text-search-davinci-doc-001",
          "openai/text-search-davinci-query-001",
          "openai/text-similarity-ada-001",
          "openai/text-similarity-babbage-001",
          "openai/text-similarity-curie-001",
          "openai/text-similarity-davinci-001",
          "text-ada-001",
          "text-babbage-001",
          "text-curie-001",
          "text-davinci-001",
          "text-davinci-002",
          "text-davinci-003",
          "text-davinci-edit-001",
          "text-embedding-3-small",
          "text-search-ada-doc-001",
          "text-search-ada-query-001",
          "text-search-babbage-doc-001",
          "text-search-babbage-query-001",
          "text-search-curie-doc-001",
          "text-search-curie-query-001",
          "text-search-davinci-doc-001",
          "text-search-davinci-query-001",
          "text-similarity-ada-001",
          "text-similarity-babbage-001",
          "text-similarity-curie-001",
          "text-similarity-davinci-001"
        ]
      },
      "mapping": {
        "config_file_hints": [
          "litellm_config.yaml",
          "litellm.yaml",
          "config.yaml"
        ],
        "model_id_candidates": [
          "ada",
          "babbage",
          "babbage-002",
          "code-davinci-002",
          "code-davinci-edit-001",
          "code-search-ada-code-001",
          "code-search-ada-text-001",
          "code-search-babbage-code-001",
          "code-search-babbage-text-001",
          "curie",
          "davinci",
          "davinci-002",
          "gpt-3.5-turbo-instruct",
          "gpt-4o",
          "openai/ada",
          "openai/babbage",
          "openai/babbage-002",
          "openai/code-davinci-002",
          "openai/code-davinci-edit-001",
          "openai/code-search-ada-code-001",
          "openai/code-search-ada-text-001",
          "openai/code-search-babbage-code-001",
          "openai/code-search-babbage-text-001",
          "openai/curie",
          "openai/davinci",
          "openai/davinci-002",
          "openai/gpt-3.5-turbo-instruct",
          "openai/gpt-4o",
          "openai/text-ada-001",
          "openai/text-babbage-001",
          "openai/text-curie-001",
          "openai/text-davinci-001",
          "openai/text-davinci-002",
          "openai/text-davinci-003",
          "openai/text-davinci-edit-001",
          "openai/text-embedding-3-small",
          "openai/text-search-ada-doc-001",
          "openai/text-search-ada-query-001",
          "openai/text-search-babbage-doc-001",
          "openai/text-search-babbage-query-001",
          "openai/text-search-curie-doc-001",
          "openai/text-search-curie-query-001",
          "openai/text-search-davinci-doc-001",
          "openai/text-search-davinci-query-001",
          "openai/text-similarity-ada-001",
          "openai/text-similarity-babbage-001",
          "openai/text-similarity-curie-001",
          "openai/text-similarity-davinci-001",
          "text-ada-001",
          "text-babbage-001",
          "text-curie-001",
          "text-davinci-001",
          "text-davinci-002",